{
  "$schema": "http://json-schema.org/draft-07/schema#",
  "type": "object",
  "additionalProperties": false,
  "required": [
    "schemaVersion",
    "component",
    "source",
    "package",
    "publication",
    "verification",
    "gitlink",
    "metadataRepair",
    "bootstrapException"
  ],
  "properties": {
    "schemaVersion": {
      "const": 1
    },
    "component": {
      "const": "rarebit"
    },
    "source": {
      "type": "object",
      "additionalProperties": false,
      "required": [
        "repository",
        "commit",
        "tree",
        "tagObject",
        "tag",
        "tagTarget"
      ],
      "properties": {
        "repository": {
          "const": "https://github.com/deephbz/rarebit.git"
        },
        "commit": {
          "const": "7f70563c11c0b28463ef08e290baba59d781a677"
        },
        "tree": {
          "const": "0a0d9c1da6126b5cc3716fe9bc46a9759e5e64ed"
        },
        "tagObject": {
          "const": "177c15e000d601e18770593b8269896a79de9e67"
        },
        "tag": {
          "const": "v0.1.0-alpha.6"
        },
        "tagTarget": {
          "const": "7f70563c11c0b28463ef08e290baba59d781a677"
        }
      }
    },
    "package": {
      "type": "object",
      "additionalProperties": false,
      "required": [
        "name",
        "version",
        "bin",
        "node",
        "piPeer"
      ],
      "properties": {
        "name": {
          "const": "@hypercarrier/rarebit"
        },
        "version": {
          "const": "0.1.0-alpha.6"
        },
        "bin": {
          "const": "rarebit"
        },
        "additionalBins": {
          "type": "array",
          "minItems": 1,
          "items": {
            "const": "piq"
          }
        },
        "piPeerOptional": {
          "type": "array",
          "minItems": 2,
          "items": {
            "enum": [
              "@earendil-works/pi-ai",
              "@earendil-works/pi-coding-agent"
            ]
          }
        },
        "node": {
          "const": ">=22"
        },
        "piPeer": {
          "type": "object",
          "additionalProperties": false,
          "required": [
            "@earendil-works/pi-ai"
          ],
          "properties": {
            "@earendil-works/pi-ai": {
              "const": ">=0.83.0"
            }
          }
        }
      }
    },
    "publication": {
      "type": "object",
      "additionalProperties": false,
      "required": [
        "sri",
        "sha1",
        "sha256",
        "tarball",
        "size",
        "unpackedSize",
        "fileCount",
        "githubRelease",
        "signature",
        "next",
        "latest",
        "bootstrapExceptionEvidence"
      ],
      "properties": {
        "sri": {
          "const": "sha512-qCbbJAOgx0i5M28n4eeOCMkpPCrMwtU4kR/9Uf3w1TQTonA1S+YG8pYwM7PzsYTkuDp55J+xQtSZ52WtWhfxZg=="
        },
        "sha1": {
          "const": "72003a4e2f3a5bc0f3674bd9d3d905a6f42aee1b"
        },
        "sha256": {
          "const": "96ac86dc4f35e03406e8a42abb266b88592417ea23d6f522d1bd6c4e473baaeb"
        },
        "tarball": {
          "const": "https://registry.npmjs.org/@hypercarrier/rarebit/-/rarebit-0.1.0-alpha.6.tgz"
        },
        "size": {
          "const": 117185
        },
        "unpackedSize": {
          "const": 503615
        },
        "fileCount": {
          "const": 60
        },
        "githubRelease": {
          "type": "object",
          "additionalProperties": false,
          "required": [
            "id",
            "url",
            "prerelease",
            "latest"
          ],
          "properties": {
            "id": {
              "const": 392815542
            },
            "url": {
              "const": "https://github.com/deephbz/rarebit/releases/tag/v0.1.0-alpha.6"
            },
            "prerelease": {
              "const": true
            },
            "latest": {
              "const": false
            }
          }
        },
        "signature": {
          "type": "object",
          "additionalProperties": false,
          "required": [
            "key",
            "value"
          ],
          "properties": {
            "key": {
              "const": "SHA256:DhQ8wR5APBvFHLF/+Tc+AYvPOdTpcIDqOhxsBHRwC7U"
            },
            "value": {
              "const": "MEUCIGVcpcGSPpPljaFuhZ4QSGvetB6KpgNtvwAk2wgFIqHRAiEA3wfIxTaFm/Uz2RWbFwiQBq5TzAWsaLzTerEMceTyx6g="
            }
          }
        },
        "next": {
          "const": "0.1.0-alpha.6"
        },
        "latest": {
          "const": "0.1.0-alpha.4"
        },
        "bootstrapExceptionEvidence": {
          "const": "https://github.com/deephbz/rarebit/releases/tag/v0.1.0-alpha.2"
        }
      }
    },
    "verification": {
      "type": "object",
      "additionalProperties": false,
      "required": [
        "ci",
        "dryRun",
        "publish"
      ],
      "properties": {
        "ci": {
          "type": "object",
          "additionalProperties": false,
          "required": [
            "run",
            "url",
            "head"
          ],
          "properties": {
            "run": {
              "const": 35579125370
            },
            "url": {
              "const": "https://github.com/deephbz/rarebit/actions/runs/35579125370"
            },
            "head": {
              "const": "7de6326a5c1d1f9a4c01cbcc28e16bcef7cc2566"
            }
          }
        },
        "dryRun": {
          "type": "object",
          "additionalProperties": false,
          "required": [
            "run",
            "url",
            "nonce",
            "head"
          ],
          "properties": {
            "run": {
              "const": 35579443036
            },
            "url": {
              "const": "https://github.com/deephbz/rarebit/actions/runs/35579443036"
            },
            "nonce": {
              "const": "0a1ef824-6f68-4fdd-80d7-862651df5ed7"
            },
            "head": {
              "const": "7de6326a5c1d1f9a4c01cbcc28e16bcef7cc2566"
            }
          }
        },
        "publish": {
          "type": "object",
          "additionalProperties": false,
          "required": [
            "run",
            "url",
            "nonce",
            "ref",
            "head",
            "attestation",
            "attestationEndpoint",
            "slsaPredicateType",
            "workflow",
            "workflowRef",
            "resolvedCommit",
            "invocation"
          ],
          "properties": {
            "run": {
              "const": 35579627947
            },
            "url": {
              "const": "https://github.com/deephbz/rarebit/actions/runs/35579627947"
            },
            "nonce": {
              "const": "475f6ef8-e963-483a-8f72-8eb5f3c8dbc7"
            },
            "ref": {
              "const": "v0.1.0-alpha.6"
            },
            "head": {
              "const": "7de6326a5c1d1f9a4c01cbcc28e16bcef7cc2566"
            },
            "attestation": {
              "const": "https://github.com/deephbz/rarebit/actions/runs/35579627947"
            },
            "attestationEndpoint": {
              "const": "https://registry.npmjs.org/-/npm/v1/attestations/@hypercarrier%2frarebit@0.1.0-alpha.6"
            },
            "slsaPredicateType": {
              "const": "https://slsa.dev/provenance/v1"
            },
            "workflow": {
              "const": ".github/workflows/publish.yml"
            },
            "workflowRef": {
              "const": "refs/tags/v0.1.0-alpha.6"
            },
            "resolvedCommit": {
              "const": "7de6326a5c1d1f9a4c01cbcc28e16bcef7cc2566"
            },
            "invocation": {
              "const": "https://github.com/deephbz/rarebit/actions/runs/35579627947/attempts/1"
            }
          }
        }
      }
    },
    "gitlink": {
      "type": "object",
      "additionalProperties": false,
      "required": [
        "path",
        "mode",
        "commit"
      ],
      "properties": {
        "path": {
          "const": "packages/hc-rarebit"
        },
        "mode": {
          "const": "160000"
        },
        "commit": {
          "const": "7f70563c11c0b28463ef08e290baba59d781a677"
        }
      }
    },
    "metadataRepair": {
      "type": "object",
      "additionalProperties": false,
      "required": [
        "originalCommit",
        "repairedCommit",
        "originalTagObject",
        "repairedTagObject",
        "commonTree",
        "reason",
        "receiptUrl",
        "receiptSha256"
      ],
      "properties": {
        "originalCommit": {
          "const": "7de6326a5c1d1f9a4c01cbcc28e16bcef7cc2566"
        },
        "repairedCommit": {
          "const": "7f70563c11c0b28463ef08e290baba59d781a677"
        },
        "originalTagObject": {
          "const": "6aa4dd7b000a7e5a7e7e65ece76b36306c5d4aed"
        },
        "repairedTagObject": {
          "const": "177c15e000d601e18770593b8269896a79de9e67"
        },
        "commonTree": {
          "const": "0a0d9c1da6126b5cc3716fe9bc46a9759e5e64ed"
        },
        "reason": {
          "const": "privacy-history-repair"
        },
        "receiptUrl": {
          "const": "https://github.com/deephbz/rarebit/releases/download/v0.1.0-alpha.6/rarebit-alpha6-final-receipt.json"
        },
        "receiptSha256": {
          "const": "ae6abc116be3a9cf8f362ad14d88572141c4e97adccfb0b097ddfb73104cddaf"
        }
      }
    },
    "bootstrapException": {
      "type": "object",
      "additionalProperties": false,
      "required": [
        "id",
        "path",
        "sha256"
      ],
      "properties": {
        "id": {
          "const": "rarebit-alpha.1-bootstrap-exception"
        },
        "path": {
          "const": "config/rarebit-alpha.1-bootstrap-exception.json"
        },
        "sha256": {
          "pattern": "^[0-9a-f]{64}$"
        }
      }
    },
    "lineage": {
      "type": "object",
      "additionalProperties": false,
      "required": [
        "sanitizedRootCommit",
        "sanitizedRootTree",
        "sourceReceipt",
        "scanner",
        "releaseReceipt",
        "legacyTagObjects"
      ],
      "properties": {
        "sanitizedRootCommit": {
          "const": "3620e9b0ddcdc4cb88771f8e16d5e88a3679480b"
        },
        "sanitizedRootTree": {
          "const": "db7d388ec449af11c2054cf460931118f70c055b"
        },
        "sourceReceipt": {
          "type": "object",
          "additionalProperties": false,
          "required": [
            "path",
            "blob",
            "sha256"
          ],
          "properties": {
            "path": {
              "const": "release/privacy-lineage.v1.json"
            },
            "blob": {
              "const": "bae1ebcb283f0c29abb7f7c42ba69c3d65d8292e"
            },
            "sha256": {
              "const": "684a8c47fd4f325d215d9976c5526e41c980b40d2a4029f4715e7cfea018de4f"
            }
          }
        },
        "scanner": {
          "type": "object",
          "additionalProperties": false,
          "required": [
            "path",
            "blob",
            "sha256"
          ],
          "properties": {
            "path": {
              "const": "release/tools/git-privacy-scan.py"
            },
            "blob": {
              "const": "887213d5d6aac3187a1631c6d985b1b0ea1385ec"
            },
            "sha256": {
              "const": "7808ae1f0a5039bd939236d17db9574f2249043a8596ca85f8f6c1270d9a2381"
            }
          }
        },
        "releaseReceipt": {
          "type": "object",
          "additionalProperties": false,
          "required": [
            "asset",
            "sha256"
          ],
          "properties": {
            "asset": {
              "const": "release/v0.1.0-alpha.5-release-receipt.md"
            },
            "sha256": {
              "const": "610bd3b76fb80700b025ada98a4c64d82cb953470d3623324bc993f0149abc5a"
            }
          }
        },
        "legacyTagObjects": {
          "type": "object",
          "additionalProperties": false,
          "required": [
            "v0.1.0-alpha.1",
            "v0.1.0-alpha.2",
            "v0.1.0-alpha.3"
          ],
          "properties": {
            "v0.1.0-alpha.1": {
              "const": "a5d6271c5ee07d872e6f98bc645266f678d41d56"
            },
            "v0.1.0-alpha.2": {
              "const": "4b06aacbfddaa1c8209fcd63731c9962bbf2536f"
            },
            "v0.1.0-alpha.3": {
              "const": "745570eb3b3de5d5295060dc4a851eff7f933e06"
            }
          }
        }
      }
    }
  }
}
