{
  "schemaVersion": 1,
  "component": "rarebit",
  "source": {
    "repository": "https://github.com/deephbz/rarebit.git",
    "commit": "7f70563c11c0b28463ef08e290baba59d781a677",
    "tree": "0a0d9c1da6126b5cc3716fe9bc46a9759e5e64ed",
    "tagObject": "177c15e000d601e18770593b8269896a79de9e67",
    "tag": "v0.1.0-alpha.6",
    "tagTarget": "7f70563c11c0b28463ef08e290baba59d781a677"
  },
  "package": {
    "name": "@hypercarrier/rarebit",
    "version": "0.1.0-alpha.6",
    "bin": "rarebit",
    "additionalBins": [
      "piq"
    ],
    "node": ">=22",
    "piPeer": {
      "@earendil-works/pi-ai": ">=0.83.0"
    },
    "piPeerOptional": [
      "@earendil-works/pi-ai",
      "@earendil-works/pi-coding-agent"
    ]
  },
  "publication": {
    "sri": "sha512-qCbbJAOgx0i5M28n4eeOCMkpPCrMwtU4kR/9Uf3w1TQTonA1S+YG8pYwM7PzsYTkuDp55J+xQtSZ52WtWhfxZg==",
    "sha1": "72003a4e2f3a5bc0f3674bd9d3d905a6f42aee1b",
    "sha256": "96ac86dc4f35e03406e8a42abb266b88592417ea23d6f522d1bd6c4e473baaeb",
    "tarball": "https://registry.npmjs.org/@hypercarrier/rarebit/-/rarebit-0.1.0-alpha.6.tgz",
    "size": 117185,
    "unpackedSize": 503615,
    "fileCount": 60,
    "githubRelease": {
      "id": 392815542,
      "url": "https://github.com/deephbz/rarebit/releases/tag/v0.1.0-alpha.6",
      "prerelease": true,
      "latest": false
    },
    "signature": {
      "key": "SHA256:DhQ8wR5APBvFHLF/+Tc+AYvPOdTpcIDqOhxsBHRwC7U",
      "value": "MEUCIGVcpcGSPpPljaFuhZ4QSGvetB6KpgNtvwAk2wgFIqHRAiEA3wfIxTaFm/Uz2RWbFwiQBq5TzAWsaLzTerEMceTyx6g="
    },
    "next": "0.1.0-alpha.6",
    "latest": "0.1.0-alpha.4",
    "bootstrapExceptionEvidence": "https://github.com/deephbz/rarebit/releases/tag/v0.1.0-alpha.2"
  },
  "verification": {
    "ci": {
      "run": 35579125370,
      "url": "https://github.com/deephbz/rarebit/actions/runs/35579125370",
      "head": "7de6326a5c1d1f9a4c01cbcc28e16bcef7cc2566"
    },
    "dryRun": {
      "run": 35579443036,
      "url": "https://github.com/deephbz/rarebit/actions/runs/35579443036",
      "nonce": "0a1ef824-6f68-4fdd-80d7-862651df5ed7",
      "head": "7de6326a5c1d1f9a4c01cbcc28e16bcef7cc2566"
    },
    "publish": {
      "run": 35579627947,
      "url": "https://github.com/deephbz/rarebit/actions/runs/35579627947",
      "nonce": "475f6ef8-e963-483a-8f72-8eb5f3c8dbc7",
      "ref": "v0.1.0-alpha.6",
      "head": "7de6326a5c1d1f9a4c01cbcc28e16bcef7cc2566",
      "attestation": "https://github.com/deephbz/rarebit/actions/runs/35579627947",
      "attestationEndpoint": "https://registry.npmjs.org/-/npm/v1/attestations/@hypercarrier%2frarebit@0.1.0-alpha.6",
      "slsaPredicateType": "https://slsa.dev/provenance/v1",
      "workflow": ".github/workflows/publish.yml",
      "workflowRef": "refs/tags/v0.1.0-alpha.6",
      "resolvedCommit": "7de6326a5c1d1f9a4c01cbcc28e16bcef7cc2566",
      "invocation": "https://github.com/deephbz/rarebit/actions/runs/35579627947/attempts/1"
    }
  },
  "gitlink": {
    "path": "packages/hc-rarebit",
    "mode": "160000",
    "commit": "7f70563c11c0b28463ef08e290baba59d781a677"
  },
  "metadataRepair": {
    "originalCommit": "7de6326a5c1d1f9a4c01cbcc28e16bcef7cc2566",
    "repairedCommit": "7f70563c11c0b28463ef08e290baba59d781a677",
    "originalTagObject": "6aa4dd7b000a7e5a7e7e65ece76b36306c5d4aed",
    "repairedTagObject": "177c15e000d601e18770593b8269896a79de9e67",
    "commonTree": "0a0d9c1da6126b5cc3716fe9bc46a9759e5e64ed",
    "reason": "privacy-history-repair",
    "receiptUrl": "https://github.com/deephbz/rarebit/releases/download/v0.1.0-alpha.6/rarebit-alpha6-final-receipt.json",
    "receiptSha256": "ae6abc116be3a9cf8f362ad14d88572141c4e97adccfb0b097ddfb73104cddaf"
  },
  "bootstrapException": {
    "id": "rarebit-alpha.1-bootstrap-exception",
    "path": "config/rarebit-alpha.1-bootstrap-exception.json",
    "sha256": "29de8a7f11e9a66489f3729454875f54a562b5c4d0ea132a4bdfbd8bc925c92e"
  },
  "lineage": {
    "sanitizedRootCommit": "3620e9b0ddcdc4cb88771f8e16d5e88a3679480b",
    "sanitizedRootTree": "db7d388ec449af11c2054cf460931118f70c055b",
    "sourceReceipt": {
      "path": "release/privacy-lineage.v1.json",
      "blob": "bae1ebcb283f0c29abb7f7c42ba69c3d65d8292e",
      "sha256": "684a8c47fd4f325d215d9976c5526e41c980b40d2a4029f4715e7cfea018de4f"
    },
    "scanner": {
      "path": "release/tools/git-privacy-scan.py",
      "blob": "887213d5d6aac3187a1631c6d985b1b0ea1385ec",
      "sha256": "7808ae1f0a5039bd939236d17db9574f2249043a8596ca85f8f6c1270d9a2381"
    },
    "releaseReceipt": {
      "asset": "release/v0.1.0-alpha.5-release-receipt.md",
      "sha256": "610bd3b76fb80700b025ada98a4c64d82cb953470d3623324bc993f0149abc5a"
    },
    "legacyTagObjects": {
      "v0.1.0-alpha.1": "a5d6271c5ee07d872e6f98bc645266f678d41d56",
      "v0.1.0-alpha.2": "4b06aacbfddaa1c8209fcd63731c9962bbf2536f",
      "v0.1.0-alpha.3": "745570eb3b3de5d5295060dc4a851eff7f933e06"
    }
  }
}
